Reclinable Mecedora La Z Boy Pinnacle ,15999,,Muebles>Reclinables,"Sillón reclinable tapizado en tela 100% poliéster de microdenier. Presenta un alto, cómodo y acojinado respaldo con la posibilidad de inclinarlo independientemente de la activación del descansapies. ",https://ss101.liverpool.com.mx/xl/1060348215.jpg
Reclinable Distinción Quito Contemporáneo,14499,,Muebles>Reclinables,Disfrute del confort de este bello reclinable mecedora,https://ss101.liverpool.com.mx/xl/1059191108.jpg
Sillón reclinable K Motion Beka ,20999,,Muebles>Reclinables,"Sillón moderno, casual y elegante con un confort excepcional. El reclinable es eléctrico y también tiene movimiento de cabecera eléctrico.",https://ss101.liverpool.com.mx/xl/1061034681.jpg
Lámpara de mesa N Narrative Anchor,1999,,Muebles>Lámparas,Encendido: Eléctrico. Alto de la Base: 43.5 cm aproximado. Ancho de la Base: 22.5 cm aproximado.,https://ss156.liverpool.com.mx/xl/1064248355.jpg
Lámpara Exterior N Narrative,499,,Muebles>Lámparas,Dimensiones 160 cm x 30 cm aproximado. Utiliza 2 baterías AA,https://ss156.liverpool.com.mx/xl/1060719698.jpg
Lámpara de escritorio N Narrative,799,,Muebles>Lámparas,Encendido: On/Off. Alto de la Base: 45.7 cm aproximado. Ancho de la Base: 15 cm aproximado. Ancho de la Pantalla  12.7 cm aproximado.,https://ss156.liverpool.com.mx/xl/1061505250.jpg
Lámpara de mesa N Narrative Hale,1999,,Muebles>Lámparas,Encendido: On/Off. Alto de la Base: 80 cm aproximado. Ancho de la Base: 20 cm aproximado.,https://ss156.liverpool.com.mx/xl/1061505110.jpg
Lámpara de pie N Narrative Octopus,4999,,Muebles>Lámparas,Alto de la Base: 210 cm aproximado. Ancho de la Base: 35 cm aproximado. Color de la Base: Negro. ,https://ss156.liverpool.com.mx/xl/1061505241.jpg
West Elm Espejo Mid-Century,9999,,Muebles>Espejos,"Nuestro espejo Mid-Century brinda un diseño con acabados en nogal y acentos en metal. Se apoya en la pared y tiene una superficie extra ancha, por lo que es ideal para clósets o vestidores.",https://ss107.westelm.com.mx/xl/1040210128.jpg
Espejo N Narrative Intco,1799,,Muebles>Espejos,Material del Marco: Molde de PS. Alto: 87 cm aproximado. Ancho: 71 cm aproximado.,https://ss161.liverpool.com.mx/xl/1064628573.jpg
Espejo de pared N Narrative Moc Hallie,4599,,Muebles>Espejos,Material: Madera con cristal. Alto: 100 cm aproximado. Ancho: 100 cm aproximado.,https://ss161.liverpool.com.mx/xl/1056019240.jpg
Espejo de pared N Narrative Vanga Madeart,6999,,Muebles>Espejos,Material del Marco: Madera. Alto: 190 cm. Ancho: 97 cm.,https://ss161.liverpool.com.mx/xl/1055698399.jpg
Espejo de pared Carre Octagonal,2999,,Muebles>Espejos,Espejo protegido con pantalla anti-estrellamiento con moldura de MDF chapeada con espejo.,https://ss161.liverpool.com.mx/xl/1054868185.jpg
Tapete Farzin Shahand 120 cm x 170 cm,5179,,Muebles>Tapetes,Forma: Rectangular. Largo: 170 cm aproximado. Ancho: 120 cm aproximado. Material: Polipropileno.,https://ss121.liverpool.com.mx/xl/1059523364.jpg
Tapete DIB Coco Square 50 cm ,329,,Muebles>Tapetes,Largo: 50 cm aproximado. Ancho: 50 cm aproximado. Material: PVC.,https://ss121.liverpool.com.mx/xl/1067709655.jpg
Tapete Beija Flor Eclectic,2199,,Muebles>Tapetes,Forma: Rectangular. Largo: 170 cm aproximado. Ancho: 120 cm aproximado. Material: Polipropileno.,https://ss121.liverpool.com.mx/xl/6634017.jpg
Tapete Beija Flor Inca Suave café,4379,,Muebles>Tapetes,Área de uso Áreas: múltiples. Estampado: Cuadros.,https://ss121.liverpool.com.mx/xl/1066486363.jpg
Tapete Beija Flor Sofi negro,2199,,Muebles>Tapetes,Área de uso Áreas: múltiples. Estampado: Rombos.,https://ss121.liverpool.com.mx/xl/1066498132.jpg
Silla alta Fisher Price Premium,3499,,Muebles>Sillas Para Bebés,"La hora de la comida se hizo mucho más fácil con la silla alta Total Clean 4 en 1 de Fisher Price. No sólo se convierte en 4 asientos diferentes para crecer junto con su bebé, desde una silla alta de tamaño completo, hasta una silla alta que se puede guardar.",https://ss413.liverpool.com.mx/xl/1065236873.jpg
Asiento Stokke Steps,3299,,Muebles>Sillas Para Bebés,Garantiza una adaptación perfecta al crecimiento del niño,https://ss413.liverpool.com.mx/xl/1052181701.jpg
Bouncer Stokke Steps,5399,,Muebles>Sillas Para Bebés,"Tu bebé descansará sobre un asiento suave y acolchado, al tiempo que se sentirá acunado en tus brazos gracias al movimiento calmante de la silla.",https://ss413.liverpool.com.mx/xl/1061495351.jpg
Sujetador Stokke Steps,2799,,Muebles>Sillas Para Bebés,"Seguro, cómodo y de diseño ergonómico",https://ss413.liverpool.com.mx/xl/7356190.jpg
Silla Nuna Zaz Pewter,8799,,Muebles>Sillas Para Bebés,"Arnés de 5 puntos de sujeción. Silla alta con diseño ultra moderno; ajuste de altura con una palanca en la parte posterior, cuenta con charola removible.",https://ss413.liverpool.com.mx/xl/1060115768.jpg
Colchón cambiador Memory Foam Baby 82 cm x 42 cm,929,,Muebles>Colchones Para Bebé,"Agradable al tacto, suave textura, brinda frescura y confort. Paredes laterales que ayudan a mantener al bebé en la parte central del cambiador.",https://ss413.liverpool.com.mx/xl/1061874531.jpg
Colchón Memory Foam Baby Placa 95 cm x 140 cm,3599,,Muebles>Colchones Para Bebé,"Ideal para la estructura ósea de los infantes, proporciona un descanso placentero gracias a que se amolda para dar un soporte uniforme",https://ss413.liverpool.com.mx/xl/1059088242.jpg
Colchón 95 cm x 140 cm Simons Baby,2799,,Muebles>Colchones Para Bebé,Alto: 12 cm aproximado. Ancho: 95 cm aproximado. Color: Blanco. Antiácaros: Sí. Hipoalergénico: Sí.,https://ss413.liverpool.com.mx/xl/1049233023.jpg
Colchón Happy Baby 70 cm x 130 cm,3199,,Muebles>Colchones Para Bebé,Largo: 130 cm aproximado. Ancho: 70 cm aproximado. Marca: SEALLY. Hipoalergénico: Sí.,https://ss413.liverpool.com.mx/xl/1056597553.jpg
Colchón cambiador Selther blanco,799,,Muebles>Colchones Para Bebé,Cambiador con cubierta plastificada y capa de algodón,https://ss413.liverpool.com.mx/xl/1025427498.jpg
Mecedora Krill Fratello,13799,,Muebles>Mecedoras,"Asiento con espuma de alta densidad, respaldo de tira zigzag de metal recubierta de una placa de poliuretano de alta densidad, brazo de tira bandastick recubierta de una placa de poliuretano de alta densidad, cojín relleno de algodón siliconado, casco de estructura metálica slider de importación, patas de soporte metálico.",https://ss413.liverpool.com.mx/xl/1065551370.jpg
Mecedora Krill Stanza,10999,,Muebles>Mecedoras,Color: PLATA,https://ss413.liverpool.com.mx/xl/1065551264.jpg
Mecedora Krill Piccolo,13299,,Muebles>Mecedoras,"Asiento con espuma de alta densidad, respaldo de tira zigzag de metal recubierta de una placa de poliuretano de alta densidad, brazo de tira bandastick recubierta de una placa de poliuretano de alta densidad, cojín relleno de algodón siliconado, casco de madera de pino de primera calidad, patas de pino laqueado.",https://ss413.liverpool.com.mx/xl/1065540769.jpg
Mecedora Concept House Keira,9299,,Muebles>Mecedoras,Material: Madera. Alto: 105 cm aproximadamente. Ancho: 64 cm aproximadamente. Profundidad: 66 cm aproximadamente.,https://media17.liverpool.com.mx/web/images/products/es_MX/xl/1028237886.jpg
Mecedora Dawood Blair,2999,2099.3,Muebles>Mecedoras,"Medidas: 67 cm x 65 cm x 43 cm aproximado. Material interior: metal, madera terciada y espuma. Material exterior: madera y tela. ",https://ss101.liverpool.com.mx/xl/1060323344.jpg
Cama Di Jan matrimonial Multimedia,48999,34299.3,Muebles>Recámaras,"Cama con sistema de elevador silencioso para tv con capacidad de 37 kgs. Compatible con tv de led con pantalla de 20""-42"", bocinas y buffer integrado, sistema surround, control remoto, puertos usb, bluetooth.",https://ss101.liverpool.com.mx/xl/1061006270.jpg
West Elm Banco Andes,9999,7999.2,Muebles>Recámaras,"Tapizado en la tela de tu elección, el Banco Andes agrega forma moderna y crujiente confección a las entradas o en el extremo de una cama.",https://ss107.westelm.com.mx/xl/1063511508.jpg
ase Dixy king size Klint Contemporáneo de madera,12999,9099.3,Muebles>Recámaras,"Tableros en madera industrializada con chapa de nogal. Soportes estructurales en madera sólida de fresno americano. Materiales forestales controlados ecológicamente, acabados de nitrocelulosa y poliuretano que permiten realizar la belleza natural de la madera. Bajo contenido de humedad y resinas.",https://ss101.liverpool.com.mx/xl/1062592440.jpg
Cabecera Dixy matrimonial Klint Contemporáneo de madera,9999,6999.3,Muebles>Recámaras,"Tableros en madera industrializada con chapa de nogal, panel tapizado en tela jacquard color gris. Soportes estructurales en madera sólida de fresno americano. ",https://ss101.liverpool.com.mx/xl/1062591591.jpg
Base Dixy matrimonial Klint Contemporáneo de madera,9499,6649.3,Muebles>Recámaras,"Tableros en madera industrializada con chapa de nogal. Soportes estructurales en madera sólida de fresno americano. Materiales forestales controlados ecológicamente, acabados de nitrocelulosa y poliuretano que permiten realizar la belleza natural de la madera.",https://ss101.liverpool.com.mx/xl/1062592423.jpg
Vinilo Vinilismo Unicornios,639,,Muebles>Viniles,"Arma tu diseño como más te guste; decora paredes, ventanas, electrodomésticos, o lo que se te ocurra.",https://ss108.liverpool.com.mx/xl/1056258481.jpg
Vinilo Vinilismo Noche de Búhos,469,,Muebles>Viniles,"Arma tu diseño como más te guste; decora paredes, ventanas, electrodomésticos, o lo que se te ocurra.",https://ss108.liverpool.com.mx/xl/1058964260.jpg
Vinilo Vinilismo Ramas Acuarela rosas,399,,Muebles>Viniles,"Arma tu diseño como más te guste; decora paredes, ventanas, electrodomésticos, o lo que se te ocurra.",https://ss108.liverpool.com.mx/xl/1056258473.jpg
Vinilo Vinilismo Paraíso Animal Fotolum,469,,Muebles>Viniles,"Arma tu diseño como más te guste; decora paredes, ventanas, electrodomésticos, o lo que se te ocurra.",https://ss108.liverpool.com.mx/xl/1058964316.jpg
Vinilo Vinilismo Cerditos Jabonosos,389,,Muebles>Viniles,"Arma tu diseño como más te guste; decora paredes, ventanas, electrodomésticos, o lo que se te ocurra.",https://ss108.liverpool.com.mx/xl/1058964286.jpg
Sofá cama Violanti Rado,10999,,Muebles>Sofá Cama,Estructura interna que se compone de madera de pino de primera y espuma. Acabado en bond leather color gris. Equipado con un herraje que permite colocarlo en tres posiciones diferentes.,https://ss101.liverpool.com.mx/xl/1030060411.jpg
Sofá cama Rachel Bali ,16999,,Muebles>Sofá Cama,Alto Cama: 50 cm aproximado. Sofá: 80 cm aproximado. Ancho Cama: 200 cm aproximado. Sofá: 200 cm aproximado. Profundidad: Cama: 133 cm aproximado. Sofá: 100 cm aproximado.,https://ss101.liverpool.com.mx/xl/1062168940.jpg
Sofá Confort Frozen Contemporáneo,15499,,Muebles>Sofá Cama,"El sofá cama Frozen gris contemporáneo de tela ha sido fabricado con madera de pino que posee una certificación forestal internacional llamada ""Sello Verde"".",https://ss101.liverpool.com.mx/xl/1063392266.jpg
Sofá Cama Artdeco,3999,,Muebles>Sofá Cama,Estilo: Contemporáneo. Color: Gris claro. Alto: 58 cm aproximado. Ancho: 78 cm aproximado. Profundidad: 82 cm aproximado.,https://ss101.liverpool.com.mx/xl/1060484321.jpg
Sofá cama LIZ Linden Contemporáneo,20999,,Muebles>Sofá Cama,Color: Chocolate. Alto: 78 cm aproximado. Ancho: 230 cm aproximado. Profundidad: 135 cm aproximado.,https://ss101.liverpool.com.mx/xl/1061553041.jpg
Mueble de Tv Madecor Albane Trendy,24999,,Muebles>Muebles de T.V.,Alto: 50 cm aproximado. Ancho: 160 cm aproximado. Profundidad: 50 cm aproximado. Material: Madera.,https://ss101.liverpool.com.mx/xl/1062242911.jpg
Mueble De T.V. Madecor Varsi Contemporáneo de madera,23999,,Muebles>Muebles de T.V.,Alto: 60 cm aproximado. Ancho: 160 cm aproximado. Profundidad: 48 cm aproximado.,https://ss101.liverpool.com.mx/xl/1062220712.jpg
Mueble para TV Jafer España Contemporáneo,6999,,Muebles>Muebles de T.V.,Mueble para TV elaborado con materiales de primera calidad para su durabilidad y funcionalidad. Tamaño práctico y preciso para las televisiones. Cuenta con una puerta con entrepaño y espacio libre para objetos varios.,https://ss101.liverpool.com.mx/xl/1059282570.jpg
Mueble para T.V. Galerías Iberia Contemporáneo tabaco,13499,,Muebles>Muebles de T.V.,Alto: 80 cm aproximado. Ancho: 144 cm aproximado. Profundidad: 50 cm aproximado.,https://ss101.liverpool.com.mx/xl/1059640409.jpg
Mueble para TV Distinción en Muebles,13999,,Muebles>Muebles de T.V.,Alto 57 cm aproximado. Ancho 150 cm aproximado. Profundidad 40 cm aproximado.,https://ss101.liverpool.com.mx/xl/1060623747.jpg
