Estufa Mabe 30 pulgadas acero,11339.33,,Linea Blanca>Estufas,Horno con bisel de acero inoxidable + terminado espejo. COLOR:ACERO.,https://ss634.liverpool.com.mx/xl/1050517124.jpg
Estufa Whirlpool 30 pulgadas,11999,7199.4,Linea Blanca>Estufas,Parrilla con encendido electrónico de botón en los quemadores. comal teflonizado 2 en 1. Horno con asador inferior a gas. COLOR:ACERO.,https://ss634.liverpool.com.mx/xl/1046514170.jpg
Estufa Mabe 30 pulgadas,18699,11219.4,Linea Blanca>Estufas,Quemador 3 Profesional Ring. máxima versatilidad ya que puedes encender de manera independiente un anillo de flama. o los tres al mismo tiempo para un calentamiento rápido y uniforme.,https://ss636.liverpool.com.mx/xl/1051447464.jpg
Estufa LG 30 pulgadas ,12199,9149.25,Linea Blanca>Estufas,Quemadores Avant. Acero inoxidable. Mejor distribución de calor en todo el horno para una cocción uniforme.,https://ss634.liverpool.com.mx/xl/1050354900.jpg
Estufa de gas Acros 30 pulgadas,8624.25,,Linea Blanca>Estufas,Horno con encendido manual. 4 quemadores estándar y 2 quemadores max.,https://ss636.liverpool.com.mx/xl/1058340665.jpg
Parrilla de gas IO Mabe 60 cm,5736.86,,Linea Blanca>Parrillas,Máxima seguridad y facilidad al encender los quemadores de la parrilla. Cuenta con un quemador triple flama que te permite cocinar a altas temperaturas. Debido al acabado de la superficie. las manchas se desprenden fácilmente. Acero inoxidable.,https://ss636.liverpool.com.mx/xl/1051447367.jpg
Parrilla de Gas Whirlpool Glass On ,17099,,Linea Blanca>Parrillas,Quemador izquierdo Tetra 10400 BTU´s. superior central estándar 4700 BTU´s. inferior central estándar 4700 BTU´s. superior derecho extra grande 9500 BTU's. inferior derecho Simmer 3000 BTU's.,https://ss636.liverpool.com.mx/xl/1007819851.jpg
Parrilla a gas IO Mabe 90 cm,12199,,Linea Blanca>Parrillas,Máxima seguridad y facilidad al encender los quemadores de la parrilla. Cuenta con un quemador triple flama que te permite cocinar a altas temperaturas. Debido al acabado de la superficie las manchas se desprenden fácilmente. Parrillas de fundición resistentes y de gran durabilidad,https://ss636.liverpool.com.mx/xl/1051447413.jpg
Parrila de gas Teka ,15199,10259.32,Linea Blanca>Parrillas,1 quemador triple flama; 1 quemador rápido; 1 quemador semi rápido; 1 quemador semi rápido y 1 quemador auxiliar,https://ss636.liverpool.com.mx/xl/1022261203.jpg
Parrilla de gas Teka 70 centímetros,10499,,Linea Blanca>Parrillas,1 Quemadores Doble flama; 1 Quemadores  rápido; 2 Quemadores semirápidos; 1 Quemadores auxiliar; 1 soporte de wok. Encendido Eléctrico y manual,https://ss636.liverpool.com.mx/xl/1057384910.jpg
Campana de pared Teka 80 cm,4599,,Linea Blanca>Campanas,Campana de acero inoxidable con tratamiento antihuella y visera frontal,https://ss636.liverpool.com.mx/xl/70774518.jpg
Campana IO Mabe 90 centímetros,10499,,Linea Blanca>Campanas,Material: Acero inoxidable. Material:  Acero inoxidable. Velocidades:  3 velocidades + boost. Tipo De Ventilación: Extracción y circulación ,https://ss636.liverpool.com.mx/xl/1051448568.jpg
Campana Teka 50 centímetros,2099,,Linea Blanca>Campanas,Tipo De Ventilación: Extracción. Velocidad Del Flujo De Aire 250 metro cubicos por hr. Filtros metálicos multicapa lavables en lavavajillas.,https://ss636.liverpool.com.mx/xl/1050904098.jpg
Campana de pared Smeg,24899.99,,Linea Blanca>Campanas,Tipo De Ventilación: Extracción y purificación. Tipo De Filtro: Antigrasa de acero inoxidable. Motor: 275. Watts: Luz 2 Watts.,https://ss636.liverpool.com.mx/xl/1058626399.jpg
Campana de pared Smeg de acero inoxidable,24899.99,,Linea Blanca>Campanas,Tipo De Ventilación: Extracción y purificación. Motor: 275 Watt. Luz 2 Watts. Número De Velocidades:  3.,https://ss636.liverpool.com.mx/xl/1058626364.jpg
Lavavajillas IO Mabe 12 servicios,15999,10799.33,Linea Blanca>Lavavajillas,Capacidad para el servicio completo de 4 personas. Cuenta con un despachador para agente de enjuague con un indicador de nivel para saber cuándo rellenar. Función para programar las horas de retraso para el inicio de lavado. Puede retrasar el inicio hasta 24 horas,https://ss636.liverpool.com.mx/xl/1049688543.jpg
Lavavajillas GE Profile 16 servicios,19199,,Linea Blanca>Lavavajillas,Gran capacidad para realizar el servicio de toda la familia. Media carga; realiza el ciclo de lavado sin la necesidad de ingresar la carga completa ahorrando agua. Sanitizante; elimina el 99.9% de las bacterias alcanzando niveles altos de temperatura,https://ss636.liverpool.com.mx/xl/1052655761.jpg
Lavavajillas Smeg 13 servicios,36899,24906.83,Linea Blanca>Lavavajillas,Sistema de protección antiinundación. Agua fría/caliente hasta a 60°C. ahorro energético con agua caliente hasta el 35%. Consumo de Energía: 120 volts.,https://ss636.liverpool.com.mx/xl/1054453597.jpg
Lavavajillas Smeg 16 servicios,24899,,Linea Blanca>Lavavajillas,Sistema de lavado: Planetarium. Sistema de secado: Por condensación natural. Opción Extra Dry; opción de inicio retardado hasta 24 horas con remojo automático. opción Quick Time.,https://ss636.liverpool.com.mx/xl/1058015985.jpg
Lavavajillas Whirlpool 15 servicios,16499,,Linea Blanca>Lavavajillas,Sensor Cycle la combinación perfecta de cada carga. Operación ultra silenciosa Quiet Partner (47dBa). Aspersores Total-Coverage. Inicio programable 2; 4 y 8 horas. Opción de lavado a alta temperatura y opción Sani Rise.,https://ss636.liverpool.com.mx/xl/1060800533.jpg
Aire Acondicionado Inverter frío Panasonic,32699,,Linea Blanca>Aires Acondicionados,Mono sensor Econavi. modo de operación seco. control de dirección de flujo de aire. modo operación automática. filtro anti-bacterias. función eliminación de olores. panel desmontable lavable. condensador Blue Fin.,https://ss634.liverpool.com.mx/xl/1050421577.jpg
Aire acondicionado frío Mabe,9599,,Linea Blanca>Aires Acondicionados,No incluye servicios de instalación eléctrica doméstica. de montaje de aire. carga refrigerante y material excedente (tubería y cableado). trabajo de albañilería.,https://ss634.liverpool.com.mx/xl/1055244118.jpg
Aire acondicionado frío y calor LG ,18799,,Linea Blanca>Aires Acondicionados,Enfriamiento rápido. limpieza automática. monitor de energía. anticorrosivo Gold Fin. refrigerante R410A.,https://ss634.liverpool.com.mx/xl/1047152239.jpg
Aire acondicionado frío LG,22899,,Linea Blanca>Aires Acondicionados,Compresor Dual Inverter. ahorro de energía. enfriamiento rápido. Jet cool. micro filtro. Plasmaster Ionizer. limpieza automática. Jet Dry. funcionamiento silencioso. Comfort Sleep. monitor de energía. refrigerante R410A.,https://ss634.liverpool.com.mx/xl/1056566143.jpg
Aire acondicionado inverter frío y calor Frikko,29929,,Linea Blanca>Aires Acondicionados,Cabado tipo espejo: Un diseño elegante e innovador para cualquier espacio. Tecnología Inverter: Enfriamiento eficaz. la velocidad del compresor se adapta a la temperatura de la habitación. Doble swing automático: Direccionamiento automático de rejillas (Horizontal y vertical). ,https://ss634.liverpool.com.mx/xl/1057591575.jpg
Calentador Bosch 11 L,7099,5324.25,Linea Blanca>Calentadores,Calentador tradicional de rápida recuperación con encendido electrónico por pulsación. perilla de regulación de temperatura. ideal para puntos de usos distantes y climas fríos. sistema que evita el sobrecalentamiento del equipo. no requiere presión de agua.,https://ss634.liverpool.com.mx/xl/1047352556.jpg
Calentador de paso para gas natural Bosch 7 L,4799,3599.25,Linea Blanca>Calentadores,Funciona con alta y baja presión. funciona con llaves monomando. ahorra hasta el 78% de consumo de gas. encendido electrónico por pilas. una perilla Smart para regular temperatura. calentador modulante. compatible con sistemas solares.,https://ss634.liverpool.com.mx/xl/1052656296.jpg
Calentador instantáneo para gas natural Bosch 20 L ,18999,,Linea Blanca>Calentadores,Equipo diseñado para exteriores; controlador alámbrico con display digital para manipular el equipo desde adentro de tu hogar. Ideal para vivienda vertical. Permite regular la temperatura grado a grado.,https://ss634.liverpool.com.mx/xl/1043859478.jpg
Calentador de depósito Bosch 40 L ,4499,,Linea Blanca>Calentadores,Calentador tradicional de depósito con encendido electrónico por pulsación. perilla de regulación de temperatura. ideal para puntos de usos distantes y climas fríos. sistema que evita el sobrecalentamiento del equipo. no requiere presión de agua.,https://ss634.liverpool.com.mx/xl/1047352572.jpg
Calentador Calorex 200 L,14399,,Linea Blanca>Calentadores,Encendido fácil y seguro con un solo botón. Modo apagado inteligente. actívalo y se apagará automáticamente después de 30 minutos sin usar agua caliente. Elige entre sus dos temperaturas: caliente o muy caliente.,https://ss634.liverpool.com.mx/xl/1068062591.jpg
Licuadora Oster ,4499,,Linea Blanca>Licuadoras y Procesadores,Potencia máxima de 2 caballos de fuerza. Funciones automáticas pre-programadas. Cuchilla con ball bearings. Cuchilla con ball bearings y motor de tecnología reversible patentada que hace girarla cuchilla en ambas,https://ss625.liverpool.com.mx/xl/1047346432.jpg
Licuadora Oster de Serie Profesional ,1699,,Linea Blanca>Licuadoras y Procesadores,La Licuadora Oster Profesional de gran durabilidad por su diseño robusto de impulsión totalmente metálica all metal drive. Dispone de un interruptor de una velocidad para procesar los diversos alimentos. más la opción para hielo.,https://ss625.liverpool.com.mx/xl/53325327.jpg
Licuadora Oster Gourmet Roja,2499,,Linea Blanca>Licuadoras y Procesadores,Licuadora con tecnología reversible e innovadora cuchilla,https://ss625.liverpool.com.mx/xl/1032841844.jpg
Procesador de alimentos Cortar y Triturar,2699,,Linea Blanca>Licuadoras y Procesadores,Tubos de alimentación extra grandes para frutas y verduras enteras disco de corte de acero inoxidable. disco de trituración de acero inoxidable hoja de cortar y mezclar espátula,https://ss625.liverpool.com.mx/xl/1063731931.jpg
Procesador de alimentos Cortar y Triturar,3450,,Linea Blanca>Licuadoras y Procesadores,Tubos de alimentación extra grandes para frutas y verduras enteras; disco de corte de acero inoxidable; disco de trituración de acero inoxidable; hoja de cortar y mezclar; espátula,https://ss625.liverpool.com.mx/xl/1063921218.jpg
Aspiradora Titanium Koblenz,4099,,Linea Blanca>Aspiradoras,La Aspiradora es una opción funcional para la limpieza de tu hogar. De extracción potente sólo produce 62 decibeles de ruido. Su sistema de filtración Hepa está diseñado para eliminar las partículas en un 99.9  lo cual te ofrece una máxima limpieza.,https://ss625.liverpool.com.mx/xl/1017763110.jpg
Aspiradora industrial Koblenz gris,1849,,Linea Blanca>Aspiradoras,Aspiradora con filtro plegado para mayor eficiencia.,https://ss625.liverpool.com.mx/xl/1008743572.jpg
Aspiradora para Auto Koblenz,549,,Linea Blanca>Aspiradoras,Portátil y de fácil manejo; filtración por medio de filtro de tela sellado; hermético y lavable,https://ss625.liverpool.com.mx/xl/1056774820.jpg
Aspiradora Air Hoover ,4299,,Linea Blanca>Aspiradoras,Tecnología wind tunnel max 3 canales para levantar la suciedad oculta en la alfombra.,https://ss625.liverpool.com.mx/xl/1047902114.jpg
Aspiradora Manual Dirt Devil ,949,768.69,Linea Blanca>Aspiradoras,Diseño moderno con mango antiderrapante para su fácil manejo.,https://ss625.liverpool.com.mx/xl/1055827342.jpg
Frigobar Smeg 1.5 pies cúbicos,19899,,Linea Blanca>Figobares,Capacidad:  1.5 pies cúbicos. Consumo de Energía:  115 Volts.,https://ss634.liverpool.com.mx/xl/1037869747.jpg
Frigobar Retro Daewoo,7599,,Linea Blanca>Figobares,Nueva línea de frigobares Daewoo Classic que combinan el diseño tradicional con la tecnología y necesidades actuales. Además la nueva línea Classic es el primer frigobar con diseño curvo y una mesa en la parte superior.,https://ss625.liverpool.com.mx/xl/1049640575.jpg
Frigobar Whirlpool 4 Pies Cúbicos,6599,,Linea Blanca>Figobares,Cuenta con congelador. 2 estantes. 1 cajón. 4 compartimentos en la puerta. control de temperatura e iluminación interior. Voltaje: 127 V - 60 Hz.,https://ss625.liverpool.com.mx/xl/1063607289.jpg
Frigobar Whirlpool 5 pies cúbicos,6299,,Linea Blanca>Figobares,Contiene congelador con charola para hielos. 2 estantes. 1 cajón. 4 compartimentos en la puerta y control de la temperatura.,https://ss625.liverpool.com.mx/xl/1063607262.jpg
Frigobar Daewoo 113 Litros,4999,,Linea Blanca>Figobares,Cuenta con dos estantes; un cajón. compartimentos en la puerta. puerta reversible. parrillas anti-derrames con detalles de aluminio.,https://ss625.liverpool.com.mx/xl/1066731444.jpg
Horno convencional Oster,4799,,Linea Blanca>Hornos Eléctricos,Horno ideal para facilitar el calentamiento de tus alimentos.,https://ss625.liverpool.com.mx/xl/1026764111.jpg
Horno Eléctrico Puerta Francesa Oster ,5599,,Linea Blanca>Hornos Eléctricos,Grill + Convección Funciones para mantener caliente. Hornear; asar; tostar. Capacidad para un pollo de 3 kg o 2 pizza de 40 cm.,https://ss625.liverpool.com.mx/xl/1050991331.jpg
Horno tostador Hamilton,1299,,Linea Blanca>Hornos Eléctricos,Capacidad para 6 rebanadas. Configurado para hornear; asar y tostar. Puede permanecer encendido y cuenta con programador de tiempo por 30 minutos con apagado automático.,https://ss625.liverpool.com.mx/xl/1063056347.jpg
Horno de convección Cuisinart,5999,,Linea Blanca>Hornos Eléctricos,Horno de convección Deluxe de acero inoxidable de la más alta calidad 0.6 pies cúbicos. El sensor Exact Heat mantiene temperaturas precisas y el control Always Even garantiza que la tostada satisfaga los gustos de su familia.,https://ss625.liverpool.com.mx/xl/1064755991.jpg
Horno Eléctrico de Convección KitchenAid,3859,,Linea Blanca>Hornos Eléctricos,El horneado por convección asegura resultados excelentes a la hora de hacer pollo asado; quiché; bizcochos de chocolate y mucho más.,https://ss625.liverpool.com.mx/xl/1055530587.jpg
Plancha de vapor Oster,799,,Linea Blanca>Planchas,Suela con cubierta cerámica y tecnología texturizada que mejora la distribución del vapor y ayuda a un planchado uniforme con menos esfuerzo y más profesional.,https://ss625.liverpool.com.mx/xl/1042659262.jpg
Plancha digital Hamilton Beach,1000,,Linea Blanca>Planchas,Cuenta con panel de control digital. Proporciona 40% más vapor continuo que la marca líder. el antiadherente Durathon es 10 veces más durable que el tradicional. Su tecnología Anti-goteo permite dar un mejor desempeño.,https://ss625.liverpool.com.mx/xl/1063210575.jpg
Plancha Hamilton Beach 1200 W,549,,Linea Blanca>Planchas,Potente desempeño de vapor con 3 opciones de apagado automático. El cable es retráctil para facilitar el almacenamiento del equipo. Salida de vapor vertical para proveer un mejor desempeño.,https://ss625.liverpool.com.mx/xl/1063210605.jpg
Plancha CHI 1700 W ,1799,,Linea Blanca>Planchas,Plancha profesional con la misma tecnología de las planchas para cabello chi. Cuenta con suela de cerámica fusionada con titanio la cual permite un deslizamiento extra suave. Es resistente a la abrasión y a los rayones; su material permite que posea una excelente retención de calor y un deslizamiento superior y extra suave.,https://ss625.liverpool.com.mx/xl/1063210559.jpg
Plancha de vapor Man,699,531.24,Linea Blanca>Planchas,Dimensiones:15.50 cm x 11.5 cm x 30 cm aproximado. Incluye: vaso dosificador de agua. Cable con giro de 360° 24 salidas de vapor laterales; 6 superiores 18 inferiores. Voltaje / Frecuencia: 120 V / 60 Hz,https://ss625.liverpool.com.mx/xl/1063737697.jpg
Brother BX3000 Máquina de Coser ,3299,,Linea Blanca>Maquinas de Coser,Plástico e interior de metal Selecciona puntadas diseños y ajustes touch. Permite llenar la bobina de hilo fácil presionando el aislador de la aguja.,https://ss649.liverpool.com.mx/xl/1051057925.jpg
Máquina de coser Brother,4999,,Linea Blanca>Maquinas de Coser,Ideal para confeccionar prendas con excelente calidad.,https://ss649.liverpool.com.mx/xl/1011884161.jpg
Máquina de coser Brother JX3135F,4499,,Linea Blanca>Maquinas de Coser,Ligera y compacta. resulta perfecta para labores básicas de costura; remiendos y personalícela con las tres carátulas decorativas intercambiables.,https://ss649.liverpool.com.mx/xl/1052274326.jpg
Singer 3223 Máquina Simple,4999,,Linea Blanca>Maquinas de Coser,Consumo de energía por unidad de tiempo en operación 30.894 Wh.,https://ss649.liverpool.com.mx/xl/1006991790.jpg
Máquina de coser Singer Legacy,12999,,Linea Blanca>Maquinas de Coser,Fácil de transportar; se coloca en cualquier superficie plana,https://ss649.liverpool.com.mx/xl/1062370510.jpg
Tostador Cuisinart ,999,799,Linea Blanca>Tostadoras y Parrilas,Elegante y compacta tostadora con detalles de acero inoxidable. Tostado a 7 posiciones. Ranuras de tostado de 1.5 pulgadas de ancho. Ideal para cualquier cocina.,https://ss625.liverpool.com.mx/xl/1063929731.jpg
Tostador Krups gris,1159,1043.1,Linea Blanca>Tostadoras y Parrilas,Almacenamiento de cable. Bandeja de migas extraíble para facilitar la limpieza. Bandeja de bollo para recalentar croissants; rollos y baguettes; Ranuras profundas para asegurar un tostado uniforme,https://ss625.liverpool.com.mx/xl/1062617213.jpg
Tostador Smeg 4 Rebanadas,3999,3419.15,Linea Blanca>Tostadoras y Parrilas,6 niveles de potencia. centrado automatico de las rebanadas. consumo de energía 120v 60HzTiempo estimado de entrega de 15 días.,https://ss625.liverpool.com.mx/xl/1049403093.jpg
Parrilla Cuisinart,6299,5039.2,Linea Blanca>Tostadoras y Parrilas,Número de sándwiches: 8 altura ajustable. regulación de temperatura. luz indicadora de listo.,https://ss625.liverpool.com.mx/xl/1063921200.jpg
Parrilla de inducción Haus,1699,,Linea Blanca>Tostadoras y Parrilas,De un solo quemador. Detección automática de sartenes. Display LED. 10 funciones ajustables. Protección contra sobrecalentamiento. Especificaciones eléctricas: 120 V - 60 Hz- 1240 W.,https://ss625.liverpool.com.mx/xl/1060207441.jpg
Horno de microondas Teka 1.4 pies cúbicos ,3699,,Linea Blanca>Microondas,Acabado en puerta Reflex doble cristal en puerta con interior de color gris y recubrimiento Easy Clean.,https://ss636.liverpool.com.mx/xl/1041487905.jpg
Horno de Microondas Whirlpool 1.6 pies cúbicos ,4199,,Linea Blanca>Microondas,"Cuenta con funciones para palomitas, pizza, suavizar/derretir, bebidas, sopa, vegetales frescos, vegetales congelados, papa, descongelar por peso y tiempo, favoritos y agregar 30 segundos. 10 niveles de potencia y 9 niveles de programación.",https://ss636.liverpool.com.mx/xl/1062826670.jpg
Horno de microondas Hamilton Beach ,1649,,Linea Blanca>Microondas,"Con botón de apertura, ventana de cristal, 6 menús de cocción, complemento ideal para tu hogar.",https://ss625.liverpool.com.mx/xl/1059808679.jpg
Horno de Microondas Grill LG,4299,,Linea Blanca>Microondas,"La tecnología Smart Inverter de LG le ofrece, una cocción más rápida y uniforme, gracias al control preciso de temperatura y mayor potencia. Cocine; caliente y descongele una gran variedad de alimentos",https://ss625.liverpool.com.mx/xl/1055917775.jpg
Horno de Microondas LG,3499,,Linea Blanca>Microondas,"La tecnología de LG le ofrece, una cocción más rápida y uniforme gracias al control preciso de temperatura y mayor potencia. Cocine; caliente y descongele una gran variedad de alimentos",https://ss625.liverpool.com.mx/xl/1055917511.jpg
Purificador Oreck 34 Metros,8999,,Linea Blanca>Purificadores de Aire,Longitud del cable: 3 metros. Peso: 3 kg. Potencia: 3. velocidades. Voltaje: 120 V,https://ss625.liverpool.com.mx/xl/1060976143.jpg
Purificador de aire Oreck ,12999,,Linea Blanca>Purificadores de Aire,Longitud del cable: 3.8 metros. Peso: 3 kg. Potencia: 3 velocidades. Voltaje: 120 V.,https://ss625.liverpool.com.mx/xl/1060976135.jpg
Purificador de Aire Rowenta,9809,,Linea Blanca>Purificadores de Aire,El único purificador de aire que filtra hasta el 99.97% de contaminación y destruye permanentemente los formaldehídos gracias a sus 4 niveles de filtración.,https://ss625.liverpool.com.mx/xl/1047482590.jpg
Purificador de aire Rowenta blanco,7599,,Linea Blanca>Purificadores de Aire,El único purificador de aire que filtra hasta el 99.97% de contaminación y destruye permanentemente los formaldehídos gracias a sus 4 niveles de filtración.,https://ss625.liverpool.com.mx/xl/1047482581.jpg
Purificador de aire Oreck 134 Metros ,4999,,Linea Blanca>Purificadores de Aire,Ideal para garantizar la calidad del aire en el hogar,https://ss625.liverpool.com.mx/xl/1043227447.jpg
Mesa de centro Distinción,8499,,Muebles>Salas,Alto Mesa:  45 cm aproximado. Ancho Mesa: 80 cm aproximado.,https://ss101.liverpool.com.mx/xl/1057933166.jpg
Mesa lateral Distinción,6499,,Muebles>Salas,Material De La Mesa:  Chapa de fresno. Alto Mesa  60 cm aproximado. Ancho Mesa  40 cm aproximado.,https://ss101.liverpool.com.mx/xl/1057933174.jpg
Consola Hammary Contemporáneo de madera,6119,,Muebles>Salas,La consola Urbana está inspirada en el estilo retro de los años 50's con un diseño en media luna que incluye líneas inclinadas y patas afiladas con un riel ovalado en la parte media entre la superficie y repisa inferior. ,https://ss101.liverpool.com.mx/xl/1011836425.jpg
Mesa de centro Vigar Yurena,4999,,Muebles>Salas,Por su estilo le dará un toque de modernidad a su espacio.,https://ss101.liverpool.com.mx/xl/1058698306.jpg
Mesa lateral Brooklyn ,11999,8399.3,Muebles>Salas,Estilo: Trendy. Color: Café. Alto Mesa: 61 cm aproximado. Ancho Mesa: 61 cm aproximado.,https://ss101.liverpool.com.mx/xl/1047229835.jpg
Mesa rectangular Saoswn Zinc ,11999,,Muebles>Comedores,Color: Café. Alto Mesa: 77 cm aproximado. Ancho Mesa: 100 cm aproximado.,https://ss101.liverpool.com.mx/xl/1060193017.jpg
Antecomedor Hyland,12999,,Muebles>Comedores,Alto Mesa: 91 cm aproximado. Ancho Mesa: 77 cm aproximado. Alto Silla: 100 cm aproximado. Ancho Silla: 48 cm aproximado,https://ss101.liverpool.com.mx/xl/1037104449.jpg
Antecomedor Frandiss Fratto ,22399,15679.3,Muebles>Comedores,"Material De La Silla: Metal. Número de Piezas: 5 (1 mesa, 4 sillas). Alto Mesa: 75 cm aproximado. Ancho Mesa: 90 cm aproximado.",https://ss101.liverpool.com.mx/xl/1046494101.jpg
Mesa Domitalia Domus,39999,,Muebles>Comedores,Alto Mesa: 75 cm aproximado. Ancho Mesa: 160 cm a 250 cm aproximado. Largo Mesa: 90 cm aproximado.,https://ss101.liverpool.com.mx/xl/1058427841.jpg
Antecomedor Pezzani ,28499,,Muebles>Comedores,Consola: Alto 125 cm x Ancho 96 cm x Profundidad 37.5 cm aproximado. Silla: Alto 78 cm x Ancho 45.5 cm x Profundidad 46 cm aproximado. Material de sillas: Polipropileno y hierro. Material de consola: Melamina y hierro.,https://ss101.liverpool.com.mx/xl/1056101973.jpg
Banco retro Intermazal Contemporáneo ,4999,,Muebles>Bar,Alto: 99 cm aproximado. Ancho: 50 cm aproximado. Profundidad: 65 cm aproximado. ,https://ss101.liverpool.com.mx/xl/1022179779.jpg
Contrabarra Madecor Varsi Contemporánea ,36999,,Muebles>Bar,Alto: 210 cm aproximado. Ancho: 120 cm aproximado. Profundidad: 40 cm aproximado. Material: Madera con cristal.,https://ss101.liverpool.com.mx/xl/7565837.jpg
Contrabarra Madecor Albane,54999,,Muebles>Bar,Alto: 210 cm aproximado. Ancho: 130 cm aproximado. Profundidad: 40 cm aproximado. Material: Madera.,https://ss101.liverpool.com.mx/xl/1062242899.jpg
Bar Liment Gris ,12999,,Muebles>Bar,Alto 72 cm x Ancho 105 cm x Profundidad 40 cm aproximado,https://cm6.liverpool.com.mx/xl/SCL6597096.jpg
Contra barra Distinción,14499,,Muebles>Bar,Alto: 200 cm aproximado. Ancho: 67 cm aproximado. Profundidad: 40 cm aproximado.,https://ss101.liverpool.com.mx/xl/1060621001.jpg
Set Terraza Keter Bistro,3999,2799.3,Muebles>Jardín,Largo: Silla 87 cm aproximado. Mesa 75 cm aproximado. Ancho: Silla 48 cm aproximado. Mesa 60 cm aproximado. Profundidad: Silla 57 cm aproximado. Mesa 60 cm aproximado.,https://ss116.liverpool.com.mx/xl/1063281685.jpg
Set Terraza Keter Chelsea,4699,,Muebles>Jardín,Largo: Silla 87 cm aproximado. Mesa 75 cm aproximado. Ancho: Silla 48 cm aproximado. Mesa 60 cm aproximado. Profundidad: Silla 57 cm aproximado. Mesa 60 cm aproximado.,https://ss116.liverpool.com.mx/xl/1063279150.jpg
"Sala 3,2,1 Topsun Munich de ratán",23999,,Muebles>Jardín,"Elaborado en fibras artificiales (PE) tejidas a mano, el juego de sala Munich de líneas rectas, viste los espacios exteriores con un toque de diseño contemporáneo.",https://ss116.liverpool.com.mx/xl/1052271815.jpg
Antecomedor con sombrilla Lottus California,8999,,Muebles>Jardín,"4 sillas plegables; 1 mesa de comedor y 1 sombrilla, diámetro en mesa 90 cm aproximado. Imagen ambientada ilustrativa, las piezas se venden por separado.",https://ss116.liverpool.com.mx/xl/1052525361.jpg
"Sala 3,2,1 Scancom Ibiza de madera natural",17999,,Muebles>Jardín,"Medidas de mesa central: Alto 52.45 cm x Ancho 120 cm x Profundidad 50.90 cm aproximado. Peso neto de 52.4 kg, peso bruto de 70.9 kg aproximado.",https://ss116.liverpool.com.mx/xl/1051301842.jpg
Mecedora reclinable Distinción Pamplona ,9999,,Muebles>Reclinables,Está comprobado que a nivel físico psicológico y emocional; el mantener un espacio en nuestra vida para dedicarle a la relajación es clave si queremos un bienestar integral,https://ss101.liverpool.com.mx/xl/1013996969.jpg
Reclinable sofá Boal Río Contemporáneo ,29499,,Muebles>Reclinables,Capacidad: Doble. Alto: 98 cm aproximado. Ancho: 222 cm aproximado. Profundidad: 102 aproximado.,https://ss101.liverpool.com.mx/xl/1018622501.jpg
